{
  "schema": "rbk.request.v1",
  "request_id": "req-02-authority-withheld",
  "action": {
    "action_id": "action-02-grant-refund",
    "action_kind": "gatekeeper.side_effect",
    "domain": "cloudflare-os-gatekeeper",
    "summary": "Approve and issue a customer refund",
    "proposed_by": {
      "actor_id": "agent-support",
      "actor_kind": "ai_agent",
      "model": "claude-sonnet-5"
    },
    "requested_dimensions": ["authorize"],
    "reversibility": "compensatable",
    "risk": {
      "impact": "low",
      "exposure": 0.1,
      "uncertainty": 0.05,
      "rationale": "Refund is compensatable via reversal transaction"
    },
    "applicability": {
      "status": "applicable"
    },
    "digest": "sha256:11d8509f8f0ab9b72a1c2ac9b6fe8ba922d97dfec36baf35b9871fede5c781fd"
  },
  "evidence_state": {
    "items": [
      {
        "evidence_id": "ev-02-policy-check",
        "mode": "static_verification",
        "outcome": "passed",
        "assurance": "runtime_observed",
        "freshness": {
          "status": "fresh",
          "observed_at": "2026-08-09T10:00:00Z"
        },
        "produced_by": "gatekeeper-rules-engine"
      }
    ],
    "digest": "sha256:df2b9d0ea3015957144a5b9b2e0a6b05e6a2412454bf7c9a919b747c0783ab5d"
  },
  "observed_at": "2026-08-09T10:05:00Z"
}
