{
  "schema": "rbk.request.v1",
  "request_id": "req-05-human-required-with-incomplete-basis",
  "action": {
    "action_id": "action-05-rewrite-billing-reconciliation",
    "action_kind": "code.patch",
    "domain": "reviewgraphen",
    "summary": "Rewrite the billing reconciliation job; the blast radius could not be estimated",
    "proposed_by": {
      "actor_id": "agent-fixit",
      "actor_kind": "ai_agent",
      "model": "claude-sonnet-5"
    },
    "requested_dimensions": ["project", "execute"],
    "reversibility": "reversible",
    "risk": {
      "impact": "critical",
      "exposure": 0.4,
      "uncertainty": 0.8,
      "rationale": "Touches money movement; the analyser could not bound how many ledgers the change reaches"
    },
    "applicability": {
      "status": "applicable"
    },
    "digest": "sha256:44224ed34c7eb8c95225454dcd255c594d0d97abd0b0b31f9ebb58c23d91100b"
  },
  "evidence_state": {
    "items": [
      {
        "evidence_id": "ev-05-test",
        "mode": "executable_test",
        "outcome": "passed",
        "assurance": "runtime_observed",
        "freshness": {
          "status": "fresh",
          "observed_at": "2026-08-09T13:00:00Z"
        },
        "produced_by": "ci-runner"
      }
    ],
    "digest": "sha256:3b1f3d341a095dcbb9c285a08014298a948a9ea50267bb008ff9c19a08ef4d85"
  },
  "observed_at": "2026-08-09T13:05:00Z"
}
